{
  "settingsId": "SETTINGS-sgm-11",
  "instanceRef": "sgm-11",
  "class": "SMProfile-InjectionMoldingMachine",
  "version": "1.0.0",
  "owner": "Maintenance",
  "displayName": "sgm-11 machine settings",
  "description": "Capability envelope of sgm-11 (Arburg Allrounder 720S, 2500 kN, hydraulic / hybrid), derived from the sim's machine master (0.7.0, owner 29.10.2026) — typical ranges of the class, process_estimate; no setup band.",
  "values": {
    "recipe:barrel_zone1_temp_band": [
      20,
      400
    ],
    "recipe:barrel_zone2_temp_band": [
      20,
      400
    ],
    "recipe:barrel_zone3_temp_band": [
      20,
      400
    ],
    "recipe:barrel_zone4_temp_band": [
      20,
      400
    ],
    "recipe:hotrunner_temp_band": [
      20,
      400
    ],
    "recipe:melt_temp_band": [
      20,
      400
    ],
    "recipe:mould_temp_band": [
      10,
      140
    ],
    "recipe:injection_speed_band": [
      0,
      200
    ],
    "recipe:back_pressure_band": [
      0,
      300
    ],
    "recipe:cooling_flow_band": [
      0,
      60
    ],
    "recipe:cycle_time_band": [
      2.0,
      600
    ]
  },
  "toleranceSource": {
    "recipe:barrel_zone1_temp_band": "process_estimate",
    "recipe:barrel_zone2_temp_band": "process_estimate",
    "recipe:barrel_zone3_temp_band": "process_estimate",
    "recipe:barrel_zone4_temp_band": "process_estimate",
    "recipe:hotrunner_temp_band": "process_estimate",
    "recipe:melt_temp_band": "process_estimate",
    "recipe:mould_temp_band": "process_estimate",
    "recipe:injection_speed_band": "process_estimate",
    "recipe:back_pressure_band": "process_estimate",
    "recipe:cooling_flow_band": "process_estimate",
    "recipe:cycle_time_band": "process_estimate"
  }
}
